Applicant name,Email,Phone Number,Expertise,Experience,Academic Background,Location
George Kirby,michellestevens@mckenzie.com,849-781-3098x98077,"Hugging Face, LLM Fine-tuning, RAG, OpenAI API, LangChain, Generative AI, Prompt Engineering",4,M.Tech in AI,Andreaborough
Brandi Chavez,rfuentes@hotmail.com,347.930.5038x773,"Transformers, PyTorch, RAG, Generative AI, Machine Learning, Deep Learning, OpenAI API",1.7,B.Tech in Computer Science,West Jenniferborough
John Ramsey,dennisobrien@gmail.com,996-453-9862x23763,"LLM Fine-tuning, OpenAI API, Generative AI, Transformers, Python, Prompt Engineering, Machine Learning, Vector DB",9.6,PhD in Machine Learning,Lake Aaron
Justin Miller,nicole81@gmail.com,792.584.0629x3741,"Deep Learning, RAG, Vector DB, PyTorch, LangChain",8.2,B.Tech in Computer Science,Ryanport
Danielle Soto,jonathan29@hotmail.com,451.223.8852,"TensorFlow, LLM Fine-tuning, FastAPI, Prompt Engineering, Vector DB",8,M.Sc in Computer Applications,Pamelastad
Daniel Davis,carrollnicole@taylor-butler.com,719-055-7082x571,"Prompt Engineering, FastAPI, Vector DB, Python, TensorFlow, Hugging Face",3,B.Sc in Data Science,Lake Thomasside
Timothy Lee,andrewsdonald@yahoo.com,027.764.3130x1169,"TensorFlow, PyTorch, LLM Fine-tuning, OpenAI API, Vector DB, Generative AI, Machine Learning, Deep Learning",8.7,PhD in Machine Learning,East Lisa
John Martin,hallalexandra@chan.com,6556832126,"Vector DB, OpenAI API, Python, Prompt Engineering, RAG, LLM Fine-tuning",7.4,PhD in Machine Learning,West Tonyside
Michelle Osborn,fparker@harris-stevenson.biz,001-745-041-3794x4722,"Python, Hugging Face, PyTorch, Vector DB, Prompt Engineering, OpenAI API, TensorFlow, RAG",5.4,PhD in Machine Learning,East Tammyport
Joseph Hawkins,matthewdudley@rodriguez.info,001-263-603-0492x7548,"Prompt Engineering, LangChain, LLM Fine-tuning, FastAPI, RAG, Machine Learning",1.2,B.Sc in Data Science,New Katherine
Carolyn Martinez,patricia57@raymond.com,+1-494-133-8263x858,"PyTorch, Generative AI, FastAPI, LangChain, Hugging Face",8.1,M.Sc in Computer Applications,Gabriellafort
Kenneth Mccormick,robert89@garza.org,(089)276-8413x058,"RAG, Generative AI, Machine Learning, PyTorch, Transformers, Hugging Face, TensorFlow, Vector DB",9.5,B.Tech in Computer Science,West Jessica
Rachel Ball,dominguezjennifer@gmail.com,+1-756-268-1475x193,"LLM Fine-tuning, Transformers, Python, Machine Learning, PyTorch, LangChain, Generative AI, Deep Learning",7.7,B.Tech in Computer Science,Riddlemouth
Jake Jimenez,paul93@hotmail.com,481-398-9350,"PyTorch, LangChain, Prompt Engineering, Transformers, TensorFlow, FastAPI, Generative AI, Hugging Face",8.3,B.Tech in Computer Science,Jamesmouth
Ashley Mays,mark83@hotmail.com,001-822-844-9627,"Machine Learning, LLM Fine-tuning, Hugging Face, Vector DB, Transformers, FastAPI",1.8,B.Tech in Computer Science,East Steven
Shelby Santiago,michaelmartin@hotmail.com,001-069-060-5437x25704,"LLM Fine-tuning, Generative AI, LangChain, OpenAI API, FastAPI, Python, PyTorch",9.8,M.Sc in Computer Applications,Wilsonstad
Amber Guerrero,amartinez@elliott.com,744543356,"Vector DB, PyTorch, OpenAI API, Python, TensorFlow, FastAPI, Transformers, Hugging Face",4.7,B.Tech in Computer Science,Clarkburgh
Angel Taylor,westcindy@hotmail.com,051.775.1334,"LangChain, Python, FastAPI, Generative AI, Deep Learning",7.7,PhD in Machine Learning,Montoyashire
Jason Lucero,robertmitchell@hotmail.com,+1-352-372-1136x007,"TensorFlow, Hugging Face, PyTorch, FastAPI, Vector DB",1.1,B.Tech in Computer Science,West Kelly
Marissa Baldwin,lserrano@yahoo.com,670.501.1359x54545,"Python, LLM Fine-tuning, LangChain, TensorFlow, Transformers, FastAPI",9.9,M.Sc in Computer Applications,New Anthony
Billy Weaver,woodwardmichelle@waters-martinez.com,624-287-0649x73023,"PyTorch, Deep Learning, TensorFlow, Python, OpenAI API",3.7,B.Sc in Data Science,New Renee
Michael Baker,angel55@williams-nolan.com,(856)449-2259x8520,"LLM Fine-tuning, Vector DB, Python, FastAPI, Prompt Engineering, Transformers, Machine Learning, OpenAI API",7.3,B.Sc in Data Science,Morganhaven
Brandi Stewart,tvazquez@hotmail.com,803-431-3763x131,"LLM Fine-tuning, Transformers, Machine Learning, FastAPI, OpenAI API, TensorFlow",9.8,M.Sc in Computer Applications,Port Mark
Bill James,davisjade@gmail.com,853-683-9557x64075,"Prompt Engineering, Machine Learning, LangChain, Generative AI, Hugging Face, TensorFlow, Vector DB, PyTorch",9.5,B.Sc in Data Science,Townsendhaven
Jill Newman,kimberlycooper@clark-anderson.org,9355623421,"RAG, Vector DB, Deep Learning, Generative AI, LangChain",9.3,B.Sc in Data Science,Barajasberg
Sara Johnson,cathy81@yahoo.com,(438)934-4060x8780,"RAG, Machine Learning, Hugging Face, OpenAI API, LangChain, PyTorch",5.6,B.Sc in Data Science,West Gregory
Zachary Elliott,isaiahwhite@smith.com,001-967-455-7602,"Prompt Engineering, Transformers, Vector DB, Python, LLM Fine-tuning, LangChain, Generative AI",3.6,B.Sc in Data Science,Johnstonmouth
Anna Taylor,kimberlypetersen@thompson.com,001-088-986-4603x4249,"Generative AI, Vector DB, LLM Fine-tuning, PyTorch, Machine Learning, Prompt Engineering, FastAPI, OpenAI API",1.6,PhD in Machine Learning,Weeksview
Brian Yang,juliabowen@russell-ruiz.com,001-761-770-4904x6089,"Vector DB, Prompt Engineering, RAG, Python, Deep Learning, Generative AI, Transformers",6,PhD in Machine Learning,New Christopher
Spencer Ferguson,gilbertdavid@baxter-sanchez.com,001-663-525-8904x1060,"TensorFlow, LangChain, OpenAI API, Transformers, Machine Learning, RAG",1.1,M.Sc in Computer Applications,Savannahfurt
Michael Fitzpatrick,erinbullock@adams-williams.com,001-359-312-0793x091,"OpenAI API, LangChain, Vector DB, LLM Fine-tuning, FastAPI, TensorFlow, Prompt Engineering, Python",1.4,M.Tech in AI,Catherineberg
Bradley Rios,milleryvonne@yahoo.com,898.649.5387,"Prompt Engineering, Deep Learning, Machine Learning, LLM Fine-tuning, RAG, Hugging Face",1.4,M.Tech in AI,New Tiffanyland
Chelsea Riley,toddcurry@yahoo.com,-10727,"Hugging Face, LLM Fine-tuning, Deep Learning, Generative AI, OpenAI API, RAG",1.1,M.Sc in Computer Applications,Port Matthew
Jill Bennett,jonesmadeline@lowery-adams.com,398.777.6560,"Python, Deep Learning, TensorFlow, FastAPI, LLM Fine-tuning, Hugging Face",4.8,M.Tech in AI,New Matthew
Mark Wilkinson Jr.,dpeterson@marquez.com,001-786-376-9470x89853,"RAG, TensorFlow, OpenAI API, Prompt Engineering, Python, FastAPI, LangChain",1.6,M.Sc in Computer Applications,Lopezchester
Angela Norris,justinthompson@hotmail.com,906.586.5431x029,"LangChain, OpenAI API, LLM Fine-tuning, Python, Deep Learning",8.1,B.Tech in Computer Science,Jonesstad
Ricardo Richardson,patricia98@hotmail.com,405.122.4483,"OpenAI API, Transformers, Vector DB, PyTorch, Deep Learning",8,PhD in Machine Learning,Millerfurt
Paul Walker,zwilliams@gmail.com,+1-174-158-3676x9259,"Hugging Face, Vector DB, PyTorch, FastAPI, Deep Learning, LLM Fine-tuning",5.5,B.Tech in Computer Science,Rebeccaton
Tracy Nelson,adrian21@robinson.com,639-409-8895x817,"Python, Generative AI, Transformers, TensorFlow, FastAPI, OpenAI API, Machine Learning, Prompt Engineering",6.3,M.Tech in AI,Jennahaven
Matthew Gonzalez,christopher93@moore.info,+1-537-726-9311x92463,"Generative AI, Machine Learning, RAG, Prompt Engineering, Deep Learning",9.1,M.Tech in AI,Williamland
Nicholas Jones,blawson@yahoo.com,026.712.6664x06402,"Hugging Face, FastAPI, LLM Fine-tuning, Python, TensorFlow, Deep Learning, Machine Learning, LangChain",8.6,M.Sc in Computer Applications,Wrightchester
Jesse Peterson,heather37@yahoo.com,+1-334-927-1315x23313,"Transformers, Deep Learning, LLM Fine-tuning, Hugging Face, Generative AI, PyTorch",5.6,B.Tech in Computer Science,South Julia
James Wise,qmoore@yahoo.com,890.166.6422x3412,"TensorFlow, LLM Fine-tuning, Deep Learning, Hugging Face, Vector DB, OpenAI API",7,B.Sc in Data Science,West Julie
Robert Mejia,medinamadison@diaz.biz,(126)935-7628x740,"Vector DB, Transformers, Prompt Engineering, LangChain, Deep Learning, Generative AI, Hugging Face, OpenAI API",1.8,PhD in Machine Learning,Lake Lance
Tanner Maxwell,fowleranna@stevens-brown.com,(060)360-3823,"TensorFlow, Transformers, RAG, Generative AI, Deep Learning",2.3,B.Tech in Computer Science,New Amberport
Kyle Lewis,peteranderson@johnson-warren.com,829-884-6903x9171,"OpenAI API, Machine Learning, LLM Fine-tuning, Generative AI, LangChain, RAG, Deep Learning",6.2,M.Sc in Computer Applications,Edwardton
Mr. Elijah Williams Jr.,scottsnyder@gmail.com,+1-951-358-9057x40171,"OpenAI API, LangChain, PyTorch, Machine Learning, TensorFlow",4.3,PhD in Machine Learning,Lake Caseymouth
Brad Bryant,martha64@yahoo.com,226-660-9497x3864,"Machine Learning, LangChain, Deep Learning, Hugging Face, Vector DB, Generative AI, Transformers",1.3,B.Tech in Computer Science,Port Ryantown
Crystal Wright,hollowaybrian@williams.org,967.832.5510x9842,"LangChain, FastAPI, Generative AI, Prompt Engineering, LLM Fine-tuning, PyTorch, TensorFlow",5.5,PhD in Machine Learning,West Stanleystad
Benjamin Reynolds,williampacheco@duke.info,851.715.2602x89387,"PyTorch, Hugging Face, Prompt Engineering, RAG, Python, LangChain, Deep Learning",3.9,B.Tech in Computer Science,Danielhaven
Amy Reyes,lori20@hotmail.com,900.290.9841x8449,"RAG, Transformers, LangChain, Vector DB, OpenAI API, LLM Fine-tuning, Prompt Engineering",1.1,B.Sc in Data Science,North Misty
Alexander Mullins,justin47@yahoo.com,001-757-590-8515x275,"Vector DB, Machine Learning, RAG, Hugging Face, FastAPI",9.9,M.Tech in AI,East Susan
Corey Diaz,bradforddavid@hotmail.com,001-323-342-3424x09646,"FastAPI, Generative AI, Transformers, Deep Learning, Hugging Face, PyTorch, TensorFlow",5.2,PhD in Machine Learning,South Francis
Courtney Ferguson,williamsbonnie@gmail.com,(754)929-5685,"Python, OpenAI API, PyTorch, Transformers, TensorFlow, Prompt Engineering, Hugging Face",6.5,M.Sc in Computer Applications,East Cynthiaport
Eric Johnson,marquezjoyce@harrington.com,829-726-2387x997,"Prompt Engineering, Generative AI, Deep Learning, Vector DB, Transformers, Hugging Face, RAG, PyTorch",6.5,B.Tech in Computer Science,Jordantown
Olivia Riddle,bennettthomas@yahoo.com,-9738,"OpenAI API, RAG, Generative AI, LangChain, Deep Learning, Vector DB",1.2,B.Tech in Computer Science,Patrickberg
Mark Rodriguez,zmurphy@wheeler-turner.com,744-705-2615x809,"FastAPI, Generative AI, TensorFlow, Python, LLM Fine-tuning, OpenAI API, Vector DB",3.4,B.Tech in Computer Science,Maryfurt
Alexander Williamson,kmorgan@gmail.com,559-850-8175,"Hugging Face, Generative AI, FastAPI, LLM Fine-tuning, Python, LangChain, Deep Learning, Vector DB",4.5,PhD in Machine Learning,North Joshuatown
Kristen Miller,martincummings@hotmail.com,682.429.9008,"Vector DB, OpenAI API, Hugging Face, LLM Fine-tuning, Generative AI, Prompt Engineering, RAG",5.1,M.Tech in AI,West Jimmyport
Kimberly Dickerson,zdaniel@simon.com,-5215,"LangChain, Transformers, OpenAI API, FastAPI, Generative AI",9.8,PhD in Machine Learning,Caitlynborough
Jeremy Wheeler,umorrison@yahoo.com,7916805242,"Vector DB, Generative AI, Hugging Face, TensorFlow, LLM Fine-tuning, FastAPI",5.2,B.Sc in Data Science,Woodsview
Christine Johnson,lmason@yahoo.com,(274)143-5846,"RAG, FastAPI, Generative AI, Prompt Engineering, LLM Fine-tuning, Deep Learning",5.1,PhD in Machine Learning,Lake Rachelstad
Diane Williams,jenny13@gmail.com,356-567-3243x4781,"Generative AI, LangChain, Hugging Face, Vector DB, RAG, FastAPI",1.8,M.Tech in AI,Hayesfurt
Desiree Phillips,xlewis@dudley-cain.com,+1-472-421-5658x9644,"LangChain, Deep Learning, Transformers, PyTorch, OpenAI API, Prompt Engineering, FastAPI",4.6,M.Sc in Computer Applications,New Meganmouth
Margaret Turner,susan75@juarez-shaffer.com,(848)941-2507,"Python, Prompt Engineering, Transformers, RAG, LangChain, Hugging Face, FastAPI",2.2,M.Tech in AI,Burgessfurt
Michelle Mendoza,stevenneal@gmail.com,315-849-5931,"TensorFlow, Transformers, Hugging Face, OpenAI API, LangChain",6.1,M.Tech in AI,North Jason
Thomas Medina,barbara68@johnson-wilson.com,001-262-965-8240,"Generative AI, TensorFlow, Prompt Engineering, RAG, LangChain",2.2,M.Tech in AI,Vasquezmouth
James Carter,gcooper@gmail.com,2320783580,"Machine Learning, Python, Transformers, Vector DB, Prompt Engineering",6.3,M.Sc in Computer Applications,Boyerfurt
Mr. Kevin Williams MD,david61@gmail.com,+1-552-608-4076x585,"Generative AI, RAG, FastAPI, PyTorch, Vector DB, Deep Learning, TensorFlow, Machine Learning",8.9,B.Tech in Computer Science,South Henry
Jennifer Jones,martintimothy@gmail.com,918.270.2637x187,"TensorFlow, Machine Learning, Prompt Engineering, Transformers, RAG",3.4,M.Sc in Computer Applications,Bonnieport
Cynthia Davidson,carlsonjoshua@frank.com,073.805.5914x2777,"OpenAI API, Deep Learning, TensorFlow, Vector DB, LangChain, Prompt Engineering, Python, FastAPI",1.9,M.Sc in Computer Applications,Atkinsonmouth
Zachary Miller Jr.,thomas92@mills-maxwell.com,4843597973,"Hugging Face, PyTorch, LangChain, Generative AI, LLM Fine-tuning",1.6,M.Sc in Computer Applications,Mendezmouth
Melissa Brown,katherineestes@hotmail.com,245.709.0148,"Vector DB, Python, Generative AI, Machine Learning, Transformers, Deep Learning, TensorFlow",8.1,M.Tech in AI,Gardnerhaven
John Hernandez,felicia51@cole.net,001-976-131-4754,"Vector DB, OpenAI API, Deep Learning, TensorFlow, Generative AI, Prompt Engineering, RAG, Hugging Face",3.3,B.Tech in Computer Science,Evelynton
Barbara English,bsimpson@gmail.com,331-076-7954x096,"Deep Learning, Vector DB, Prompt Engineering, Machine Learning, Generative AI, RAG, Transformers, Hugging Face",3.4,PhD in Machine Learning,Elizabethtown
Sharon Chapman,cmonroe@green-ramirez.com,616.412.6540x098,"Generative AI, RAG, PyTorch, OpenAI API, Prompt Engineering, Python, LLM Fine-tuning",8,PhD in Machine Learning,North Brianside
Stephanie Howell,zhorn@goodman.com,001-330-600-7574,"FastAPI, OpenAI API, Machine Learning, PyTorch, Vector DB, Prompt Engineering",10,M.Tech in AI,Richardfort
Michelle Lynn,uharrington@gmail.com,(719)710-7264,"Deep Learning, Vector DB, LLM Fine-tuning, FastAPI, RAG, OpenAI API, Python",9.7,B.Sc in Data Science,East Thomasberg
Matthew Weaver,derekpaul@adams.com,+1-202-503-7458x8557,"Vector DB, RAG, TensorFlow, LLM Fine-tuning, Python",3.2,B.Tech in Computer Science,Frankberg
Monica Lopez,kochbeverly@martinez.com,001-596-211-8429x956,"RAG, OpenAI API, TensorFlow, Transformers, Deep Learning, Vector DB",7.4,B.Tech in Computer Science,East Jamesfort
Anthony Estrada,othompson@donovan-hanson.biz,(545)709-5226,"Vector DB, Machine Learning, RAG, Python, PyTorch, LangChain",7.4,M.Sc in Computer Applications,Port Jesse
Samantha Murray,ellisonsarah@stephens.com,(467)239-7813x344,"Hugging Face, Generative AI, Transformers, Deep Learning, LLM Fine-tuning",8,PhD in Machine Learning,Port Carly
Walter Perkins,ashley12@hotmail.com,433.278.5287,"FastAPI, Python, TensorFlow, Deep Learning, Vector DB, OpenAI API",4.9,B.Tech in Computer Science,New Tamarashire
Kenneth Zimmerman,matthewsmith@yahoo.com,001-214-415-7637x8950,"Generative AI, Deep Learning, Prompt Engineering, PyTorch, TensorFlow, Transformers",4.1,M.Tech in AI,Lake Peter
Shannon Soto,znoble@yahoo.com,(000)698-5985x1358,"Machine Learning, PyTorch, Generative AI, OpenAI API, Vector DB, LLM Fine-tuning, Python",4,M.Tech in AI,East Virginia
Michael Park,kennethbaker@rosario.com,574.452.0064x9393,"Vector DB, Deep Learning, Transformers, FastAPI, TensorFlow",4.6,PhD in Machine Learning,Angelamouth
Darlene Thornton,barneselizabeth@gmail.com,338.435.7607x1428,"LangChain, Transformers, Vector DB, Prompt Engineering, TensorFlow, Machine Learning, OpenAI API, LLM Fine-tuning",6.5,PhD in Machine Learning,Fordbury
Scott Johnson DDS,wcollins@vega.com,3396378623,"OpenAI API, Python, LangChain, Generative AI, FastAPI",9.7,M.Sc in Computer Applications,Taylorstad
James Rose,andrewsantos@hotmail.com,(535)700-2877x68162,"Machine Learning, Generative AI, Python, TensorFlow, LLM Fine-tuning",9.8,PhD in Machine Learning,West Amandachester
Bryan Thomas,rgonzalez@hotmail.com,+1-803-975-5168x7108,"LLM Fine-tuning, Hugging Face, Vector DB, RAG, Prompt Engineering, OpenAI API, Generative AI, Transformers",8.5,M.Sc in Computer Applications,Robertshaven
Kimberly Fischer,alex97@brown.net,001-741-545-2241x28145,"Generative AI, TensorFlow, RAG, Deep Learning, LLM Fine-tuning",3.2,B.Sc in Data Science,Sheilaborough
Leonard Ward,jeffrey20@yahoo.com,001-302-548-3497x6754,"Machine Learning, LangChain, Prompt Engineering, Generative AI, Vector DB",6.9,B.Sc in Data Science,South Brian
Mathew Vargas,maynarddaniel@gmail.com,263.713.0072x10371,"Vector DB, TensorFlow, RAG, Transformers, PyTorch",5.5,B.Sc in Data Science,Port Evan
Kathleen Johnson,johnsonalyssa@massey.info,(188)870-1962,"Transformers, RAG, Hugging Face, Deep Learning, Machine Learning, PyTorch",1.3,M.Tech in AI,South Joann
Donna Hubbard,darryl54@yahoo.com,(884)234-6013,"Vector DB, LangChain, OpenAI API, TensorFlow, RAG, Generative AI, Hugging Face",4,M.Sc in Computer Applications,South Ronald
Julie Mason,brownjoshua@cobb.com,100.867.7666,"RAG, FastAPI, TensorFlow, OpenAI API, LLM Fine-tuning, PyTorch, Deep Learning, LangChain",8.8,M.Sc in Computer Applications,Lake Brooketon
Stephanie Miller,carrieburton@gmail.com,(399)194-3777x76817,"Prompt Engineering, Generative AI, Transformers, Deep Learning, TensorFlow, RAG, LLM Fine-tuning",8.1,M.Tech in AI,East Summer
Zachary Coleman,rebekahmiller@jackson.com,001-557-757-5081x41119,"PyTorch, Machine Learning, Prompt Engineering, OpenAI API, Python, LangChain",2.5,B.Tech in Computer Science,East Michael
Denise Lloyd,danielleweaver@hood.org,+1-713-596-9362x1116,"Machine Learning, FastAPI, Python, Generative AI, LLM Fine-tuning, Vector DB, Deep Learning, Hugging Face",6.1,M.Sc in Computer Applications,North Vanessaport
Lisa Snyder,tcervantes@atkinson-hall.info,(706)275-4052x3640,"Vector DB, RAG, OpenAI API, Deep Learning, TensorFlow, LangChain, Python",5.4,M.Sc in Computer Applications,Port Javier
Samuel Preston,jacob07@graham-wiley.com,(854)105-9784,"Transformers, RAG, FastAPI, TensorFlow, Vector DB, Deep Learning, LLM Fine-tuning",5.8,PhD in Machine Learning,Kochborough
Elaine Johnson,huynhedwin@gamble.com,001-027-053-4056,"LLM Fine-tuning, Prompt Engineering, Generative AI, Machine Learning, Transformers, Vector DB, Python, RAG",9.2,B.Sc in Data Science,East Lisa
Cindy Roach,leedaniels@lynch-edwards.com,969-071-5868x0410,"LLM Fine-tuning, Deep Learning, Prompt Engineering, Machine Learning, Python, OpenAI API, PyTorch, Hugging Face",9,B.Sc in Data Science,Robertborough
Tracy Harris,andersonrobert@gmail.com,001-369-445-7100x4676,"TensorFlow, FastAPI, RAG, Hugging Face, LLM Fine-tuning",3.1,M.Sc in Computer Applications,Hillchester
Caroline Harris,ajohnston@gmail.com,493-121-8975x192,"Hugging Face, OpenAI API, FastAPI, TensorFlow, RAG",8.7,M.Sc in Computer Applications,New Jeffrey
Molly Hodges,stacey32@hotmail.com,391.668.0665,"Vector DB, Machine Learning, Transformers, Prompt Engineering, LangChain, FastAPI",5.9,B.Tech in Computer Science,Lake Deborah
Christina Murphy,michaelhaas@hotmail.com,044.802.0046x3961,"RAG, Python, LLM Fine-tuning, FastAPI, LangChain, Machine Learning, PyTorch, OpenAI API",2.8,M.Tech in AI,East Christopher
Anthony Morgan,melissa97@henderson.com,293-317-2827x534,"Deep Learning, Hugging Face, RAG, PyTorch, Machine Learning",4.6,M.Sc in Computer Applications,Franklinland
Jessica Kirk,jennifer04@townsend-jacobson.biz,+1-082-867-7924x084,"OpenAI API, Generative AI, Hugging Face, Transformers, PyTorch, RAG",8.5,M.Tech in AI,South Courtneyborough
Miguel Kaufman,janetsmith@young.com,004.489.4684,"Generative AI, LangChain, Deep Learning, Python, PyTorch, FastAPI, Machine Learning, Vector DB",8.1,PhD in Machine Learning,West Rebeccaport
Jennifer Schwartz,ngriffin@duke.com,(921)798-1409,"Vector DB, Generative AI, OpenAI API, Deep Learning, Hugging Face, Transformers, TensorFlow",2.9,PhD in Machine Learning,Gregport
Justin Jones,javier42@ellis.org,776.665.4818x046,"FastAPI, Deep Learning, OpenAI API, TensorFlow, LLM Fine-tuning",5.7,M.Tech in AI,Lake Arielchester
Lisa Nelson,jessica86@barr.com,001-669-276-9256x50874,"Prompt Engineering, PyTorch, Deep Learning, LLM Fine-tuning, Machine Learning, Transformers",1.9,B.Tech in Computer Science,Nathanville
Juan Sanchez,davispaula@hotmail.com,(241)328-0957,"LangChain, Prompt Engineering, TensorFlow, Deep Learning, PyTorch, Transformers, Machine Learning",8.5,M.Tech in AI,Craigmouth
Stacy Hansen,stevenpeters@bush.net,1963088889,"Transformers, TensorFlow, Hugging Face, Machine Learning, OpenAI API, FastAPI, Python, LLM Fine-tuning",4.2,M.Tech in AI,Darrenville
Wanda Stewart,leahking@yahoo.com,001-272-163-2947,"Hugging Face, Deep Learning, LangChain, LLM Fine-tuning, Vector DB, OpenAI API",1.3,B.Tech in Computer Science,New Bradleyfurt
Richard Evans,omayer@jones.com,001-892-594-2992,"OpenAI API, Deep Learning, Hugging Face, Machine Learning, Prompt Engineering, LLM Fine-tuning",5.8,M.Tech in AI,Cookburgh
Megan Allen,heathercarpenter@yahoo.com,(619)111-1062x299,"Hugging Face, Generative AI, PyTorch, Python, Vector DB, Prompt Engineering, LangChain, TensorFlow",4.2,M.Sc in Computer Applications,West Donnaland
Ashley Clayton,ashleybradley@hubbard-lewis.com,335-366-0274,"LLM Fine-tuning, OpenAI API, TensorFlow, Prompt Engineering, PyTorch, LangChain, Generative AI, Deep Learning",1.6,PhD in Machine Learning,Lake Chadshire
Brandon Blackburn,kathryn87@bruce-neal.com,666-961-0757x751,"LLM Fine-tuning, OpenAI API, Hugging Face, Python, Deep Learning, Prompt Engineering",9.9,M.Sc in Computer Applications,South Jasonberg
Timothy Warner DDS,daniel53@yahoo.com,260.814.2933x16794,"OpenAI API, Vector DB, Hugging Face, Python, Machine Learning, TensorFlow",8.8,PhD in Machine Learning,Steveton
James Walker DDS,udaniels@thompson.net,424.855.8188x371,"PyTorch, Python, Deep Learning, TensorFlow, OpenAI API, Hugging Face, RAG, Vector DB",7.3,M.Tech in AI,South Karastad
Joseph Blake,carlaanderson@holloway-nguyen.org,416-765-5045,"LangChain, TensorFlow, Deep Learning, OpenAI API, Transformers",7.6,M.Tech in AI,East Marymouth
Kellie Johnson,toddtaylor@arias.com,-9216,"LLM Fine-tuning, PyTorch, FastAPI, Deep Learning, Machine Learning, TensorFlow, Hugging Face, Vector DB",5.9,M.Tech in AI,New Adammouth
Bonnie Johnson,steven04@grant.com,286.924.3504x29202,"Hugging Face, Machine Learning, FastAPI, Python, LLM Fine-tuning, Vector DB, TensorFlow",8.3,M.Tech in AI,Ruiztown
Ricardo Robinson,mcampbell@scott.info,919-436-6811x679,"Prompt Engineering, OpenAI API, TensorFlow, Deep Learning, Python, Hugging Face, Transformers, PyTorch",3.7,M.Sc in Computer Applications,Lake Shannon
Benjamin Crawford,hpaul@gmail.com,630.857.3910,"Transformers, OpenAI API, LLM Fine-tuning, Machine Learning, TensorFlow, RAG, Generative AI",4.2,M.Tech in AI,Jeffreyside
Stephen Walter,kyle38@taylor.com,921-624-6886,"Vector DB, Transformers, Generative AI, PyTorch, Python",7.2,B.Tech in Computer Science,Pamelaton
Michael Wyatt,fredericksarah@gmail.com,+1-084-099-5882x9386,"Vector DB, OpenAI API, Python, RAG, LangChain, Hugging Face, PyTorch",7.6,PhD in Machine Learning,New Carolyn
Sarah Brooks,stephenibarra@yahoo.com,001-448-590-4749x02451,"Python, RAG, PyTorch, Generative AI, Hugging Face, TensorFlow",3.2,M.Tech in AI,West Robert
Carrie Brown,elizabeth78@gmail.com,689-931-4415x3293,"Python, LangChain, Transformers, Machine Learning, OpenAI API, TensorFlow, Vector DB",1.9,B.Tech in Computer Science,Sandratown
Sarah Baker,thomasjohnson@lopez.info,(439)842-6167x233,"FastAPI, Python, PyTorch, Prompt Engineering, TensorFlow, Vector DB",5,PhD in Machine Learning,West Kathleen
Amanda Harper,whitney21@gonzalez-malone.com,564.748.2112x26963,"Deep Learning, Generative AI, Python, TensorFlow, LangChain, FastAPI",2.1,M.Tech in AI,Lake Donald
Craig Patel,richard91@yahoo.com,395.750.2284x7866,"PyTorch, FastAPI, Python, LLM Fine-tuning, Generative AI",8.8,PhD in Machine Learning,Port Vincent
Matthew Sandoval,smithcameron@williams-quinn.com,(074)742-5165x3235,"Transformers, Machine Learning, Hugging Face, Deep Learning, PyTorch",8.9,B.Sc in Data Science,Kathrynburgh
Ralph Green,lanedennis@gibson.com,001-982-326-6888,"TensorFlow, Hugging Face, LLM Fine-tuning, RAG, Python, Prompt Engineering, PyTorch",8.5,PhD in Machine Learning,North Edwardberg
Kimberly Trujillo,margaretschmidt@gmail.com,1846977810,"LangChain, Machine Learning, LLM Fine-tuning, Deep Learning, Hugging Face",1.3,B.Tech in Computer Science,North Maxfort
Sheila Rivera,mark65@middleton.com,(505)781-8297x11330,"RAG, LangChain, LLM Fine-tuning, FastAPI, TensorFlow, Prompt Engineering, Deep Learning, Generative AI",1.5,PhD in Machine Learning,Lake Crystalview
Thomas Norris,trevormadden@gmail.com,+1-729-751-1806x6184,"LangChain, RAG, Transformers, PyTorch, FastAPI, LLM Fine-tuning, OpenAI API, Prompt Engineering",7.5,M.Tech in AI,Lake Valerie
Jean Lee,qestrada@hotmail.com,(948)352-7218x2287,"OpenAI API, TensorFlow, Machine Learning, Python, Generative AI, LangChain",1.6,M.Tech in AI,Brownchester
Christopher Lane,wendy57@wade.com,295.089.8923,"FastAPI, LangChain, Deep Learning, LLM Fine-tuning, TensorFlow",7.9,PhD in Machine Learning,North Lanceport
Matthew Taylor,csmith@lopez-vance.com,885.556.3930x050,"Deep Learning, Python, OpenAI API, Prompt Engineering, Machine Learning",4.7,M.Tech in AI,Wallaceside
Timothy Baird,dianerichard@gmail.com,1998870810,"Transformers, LLM Fine-tuning, Prompt Engineering, Deep Learning, Generative AI, FastAPI, OpenAI API, Python",4.1,PhD in Machine Learning,Jessicashire
Sara Perkins,jose80@patel.com,+1-960-101-2499x3712,"RAG, LangChain, OpenAI API, Python, Generative AI, Prompt Engineering",5.7,B.Sc in Data Science,Port Nicole
Anita Brown,icurtis@allison.com,+1-183-496-7816x1191,"Hugging Face, FastAPI, RAG, LangChain, LLM Fine-tuning, Vector DB",5.8,B.Sc in Data Science,Lisachester
