Applicant name,Email,Phone Number,Expertise,Experience,Academic Background,Location
Andrew Howard,kaitlin12@yahoo.com,(086)423-2963,"Deep Learning, Hugging Face, LangChain, TensorFlow, RAG, Prompt Engineering, Machine Learning",2.7,M.Sc in Computer Applications,Teresatown
Nathaniel Wilcox,gspencer@ramirez-stephens.com,+1-739-274-0214x377,"TensorFlow, Machine Learning, LLM Fine-tuning, FastAPI, Transformers, Generative AI, OpenAI API, Hugging Face",6.4,M.Tech in AI,New Charlesfort
Dr. Cody Thompson,gravesderrick@hotmail.com,001-283-304-4422,"Deep Learning, PyTorch, FastAPI, Generative AI, Vector DB",9.9,B.Tech in Computer Science,Erikaville
Robert Wilson,arnoldyesenia@mercer.biz,029.676.8927x0915,"Vector DB, LLM Fine-tuning, OpenAI API, LangChain, Prompt Engineering, RAG, FastAPI",1.8,PhD in Machine Learning,Port Garyton
Tamara Mitchell,chad44@gmail.com,001-655-000-3301x467,"Prompt Engineering, RAG, Deep Learning, Transformers, Generative AI, Hugging Face",5.1,B.Sc in Data Science,Chavezbury
Angela Cruz,julie17@hess.com,120-722-2701x1463,"LLM Fine-tuning, LangChain, Generative AI, Python, Prompt Engineering, Hugging Face, RAG, Machine Learning",5.5,M.Tech in AI,Lake John
Ryan Sullivan,christinefrazier@yahoo.com,(692)934-4131x8624,"Generative AI, PyTorch, OpenAI API, LangChain, RAG, Transformers, Machine Learning, FastAPI",1.3,PhD in Machine Learning,West Brandi
Sara Butler,benjamin78@yahoo.com,714-556-4883,"RAG, OpenAI API, FastAPI, PyTorch, Machine Learning, Generative AI",5.1,B.Tech in Computer Science,Kellyfurt
Anthony Davis,theresahancock@allen-owens.com,+1-731-975-8322x5538,"FastAPI, LLM Fine-tuning, Machine Learning, Generative AI, Vector DB, PyTorch, TensorFlow, OpenAI API",3.4,B.Sc in Data Science,Matthewhaven
Dennis Bell,sarahchavez@rivera-oneal.com,331-879-8244x861,"PyTorch, Prompt Engineering, Hugging Face, Vector DB, FastAPI, Transformers",3,B.Sc in Data Science,Evansfort
Theresa Perry,ppeters@mcconnell-carpenter.com,519.514.2868x043,"Deep Learning, Transformers, FastAPI, Machine Learning, TensorFlow, Vector DB, PyTorch, Prompt Engineering",6.5,M.Sc in Computer Applications,East Sarahville
Amy Wilson,hornlaura@yahoo.com,+1-380-785-9753x0003,"Vector DB, Hugging Face, OpenAI API, FastAPI, RAG, Deep Learning",8.7,M.Tech in AI,Roytown
Robert Wright,destiny77@bell-cooley.com,+1-541-887-8788x792,"LangChain, Prompt Engineering, LLM Fine-tuning, Python, Hugging Face, Machine Learning",7.4,PhD in Machine Learning,West Dawnside
Angela Johnson,natashaburton@nguyen-short.org,(038)149-1423,"PyTorch, LangChain, LLM Fine-tuning, Machine Learning, Vector DB, Hugging Face, Deep Learning",1.9,M.Tech in AI,Brianville
Andrew Parker,xtaylor@webb.net,001-020-281-8427x98596,"Transformers, Machine Learning, LangChain, Deep Learning, FastAPI, Hugging Face, TensorFlow",1.7,M.Sc in Computer Applications,Petershire
Ronald Schroeder,annasmith@stark.biz,001-041-222-5137,"FastAPI, Hugging Face, PyTorch, Generative AI, LangChain, LLM Fine-tuning, Transformers",6.9,B.Tech in Computer Science,South Gloria
Sarah Foster,melissawall@nolan.com,411-423-3348x68640,"TensorFlow, Transformers, RAG, LLM Fine-tuning, FastAPI",2.6,B.Sc in Data Science,Reynoldshaven
Erica Smith,jonclark@gmail.com,528.943.7823x5903,"Hugging Face, OpenAI API, FastAPI, PyTorch, Transformers, Generative AI",5,M.Sc in Computer Applications,Carlburgh
Mitchell Thomas,karen74@heath-weber.com,857-219-5472,"PyTorch, Hugging Face, RAG, Deep Learning, FastAPI",1.4,B.Sc in Data Science,Lake Larry
Sophia Villa,kaiserjennifer@yahoo.com,468.700.2178x99137,"FastAPI, Deep Learning, Machine Learning, RAG, LLM Fine-tuning",2,M.Sc in Computer Applications,Amyport
Micheal Wells,durhamcory@hernandez.com,332-479-6786x322,"Prompt Engineering, PyTorch, OpenAI API, RAG, Deep Learning",4.5,PhD in Machine Learning,Henrystad
Alexander Cox,alice20@boyd.com,(949)380-0282,"Python, LangChain, RAG, PyTorch, Transformers, Prompt Engineering, LLM Fine-tuning",1.8,M.Tech in AI,Marcusport
Mr. Christopher Hernandez,lblack@hotmail.com,+1-111-275-6963x10231,"FastAPI, Python, Machine Learning, Hugging Face, Vector DB, PyTorch, Generative AI, OpenAI API",5.9,M.Tech in AI,South Michael
Karen Best,vfloyd@gmail.com,001-897-099-7739x7766,"FastAPI, Generative AI, Vector DB, LangChain, LLM Fine-tuning, Prompt Engineering, TensorFlow",6.8,PhD in Machine Learning,East George
Douglas Thompson,matthew02@gmail.com,(268)042-7511x79822,"PyTorch, Generative AI, TensorFlow, Deep Learning, Hugging Face, RAG, Prompt Engineering",5.2,B.Tech in Computer Science,East Maryville
Mark Gallegos,sparksrachel@patterson-gray.com,001-714-302-9758,"RAG, Machine Learning, Vector DB, FastAPI, PyTorch, Prompt Engineering, TensorFlow, OpenAI API",8.7,B.Tech in Computer Science,Pamelaborough
Kim Fischer,grayanthony@morris-taylor.com,(295)102-7813x7544,"RAG, Python, Hugging Face, Machine Learning, Prompt Engineering, OpenAI API",5.1,B.Tech in Computer Science,Stephensbury
Patrick Stevens,adamhicks@yahoo.com,-10056,"Python, Machine Learning, RAG, LLM Fine-tuning, FastAPI, Vector DB, Transformers, Deep Learning",3.6,B.Sc in Data Science,Nguyenton
Scott Smith DVM,vjimenez@gmail.com,690.112.5557,"Python, RAG, Transformers, Generative AI, Machine Learning, LLM Fine-tuning, PyTorch, TensorFlow",8.1,M.Tech in AI,Port Alexandra
Jim Cardenas,iferrell@gonzales-hoover.com,816.092.3677,"LangChain, Machine Learning, TensorFlow, Vector DB, Python, Transformers, Deep Learning, RAG",4.8,M.Sc in Computer Applications,Bryanchester
David Mills,irocha@rowe-galvan.info,001-020-166-2258x0941,"Prompt Engineering, Vector DB, Python, FastAPI, PyTorch, Generative AI, TensorFlow",8.1,B.Sc in Data Science,East Aliciaport
Frank Wagner,lisamoyer@gmail.com,001-769-251-5968x88613,"LLM Fine-tuning, Machine Learning, TensorFlow, RAG, Vector DB, LangChain",4.6,PhD in Machine Learning,East Tyler
Brittany Johnston,utapia@lopez.com,066.828.0326x323,"Prompt Engineering, Vector DB, Machine Learning, TensorFlow, RAG, LangChain, LLM Fine-tuning, PyTorch",7.3,PhD in Machine Learning,Jimmybury
Austin Ryan,bakerjoseph@carney.info,898-182-2528,"Deep Learning, PyTorch, FastAPI, LangChain, Machine Learning, Transformers, LLM Fine-tuning, TensorFlow",1.6,PhD in Machine Learning,West Matthewton
Kelly Johnson,angelicabernard@mcdaniel.com,789-938-2999,"PyTorch, OpenAI API, Transformers, FastAPI, LLM Fine-tuning, TensorFlow, Machine Learning",3.6,M.Sc in Computer Applications,East Daniel
Amanda Ortiz,melissastewart@gmail.com,(574)205-2451x3634,"Prompt Engineering, OpenAI API, Transformers, Vector DB, LangChain",3.6,PhD in Machine Learning,Jasontown
Craig Taylor,ithompson@yahoo.com,001-257-536-3013x4462,"Prompt Engineering, Deep Learning, OpenAI API, RAG, TensorFlow, Transformers",1.6,B.Sc in Data Science,North Michelle
Matthew Rogers,qsalazar@baker.info,-2291,"LLM Fine-tuning, LangChain, FastAPI, TensorFlow, RAG, Machine Learning, OpenAI API, Hugging Face",9.4,PhD in Machine Learning,Bradshawview
Derek Johnston,ibaker@yahoo.com,251.776.4401,"Vector DB, OpenAI API, FastAPI, Python, Generative AI, Hugging Face",6.6,B.Sc in Data Science,North Barry
Jessica Chavez,luis99@yahoo.com,(917)994-7559x4996,"Transformers, TensorFlow, Machine Learning, RAG, LangChain",6.2,B.Sc in Data Science,South Rayland
Joshua Carroll,jessechavez@smith-jenkins.com,2063064944,"Generative AI, PyTorch, Python, OpenAI API, Transformers",4.3,M.Tech in AI,Grayfort
Amy Fletcher,ericbennett@washington.org,001-033-235-3900,"FastAPI, LangChain, Transformers, OpenAI API, Prompt Engineering, Hugging Face, PyTorch",7.5,B.Sc in Data Science,East Carolynview
Sharon Ortiz,robertchristensen@hotmail.com,293.688.2625x305,"TensorFlow, Vector DB, RAG, Prompt Engineering, Generative AI, PyTorch, Hugging Face",4.2,M.Tech in AI,East Kyleshire
April Chen,troydaugherty@white-briggs.net,332-174-7396,"Machine Learning, OpenAI API, FastAPI, PyTorch, Hugging Face, TensorFlow, Deep Learning, Generative AI",2.7,M.Sc in Computer Applications,Port Kimberlyberg
Patricia Young,spearson@thomas.org,001-489-779-0721x636,"Transformers, Prompt Engineering, LangChain, Python, Vector DB, FastAPI, LLM Fine-tuning, TensorFlow",1.2,B.Tech in Computer Science,Port Tashahaven
Jim Peterson,silvanorman@quinn.com,7600426470,"Vector DB, Python, Deep Learning, OpenAI API, LLM Fine-tuning, Hugging Face, TensorFlow, Prompt Engineering",4.7,B.Tech in Computer Science,South Lisa
Amanda Kent,katierobinson@yahoo.com,921872659,"Machine Learning, Generative AI, LLM Fine-tuning, TensorFlow, Transformers, Vector DB",4.5,M.Tech in AI,Port Katherineland
Jennifer Daniels,hcrosby@yahoo.com,001-179-571-2083x425,"Deep Learning, OpenAI API, Python, LangChain, LLM Fine-tuning, PyTorch, Prompt Engineering, RAG",4.3,M.Tech in AI,Wilcoxtown
Jennifer Terrell,kristinapugh@gmail.com,180-051-8909x72356,"FastAPI, Deep Learning, Python, Transformers, LLM Fine-tuning, Vector DB, Machine Learning, Prompt Engineering",2.6,B.Tech in Computer Science,New Markton
Brittney Villarreal,johnsonsarah@robinson-larson.com,8537201641,"FastAPI, PyTorch, Machine Learning, RAG, LangChain",3.6,PhD in Machine Learning,South Sean
David Garcia,kaitlin33@hotmail.com,+1-964-231-6143x557,"Prompt Engineering, Transformers, PyTorch, Machine Learning, OpenAI API, RAG",7.1,PhD in Machine Learning,Lake Beverly
Erica Franklin,cynthiasingh@gmail.com,001-217-611-3669x9227,"Python, Machine Learning, RAG, Deep Learning, OpenAI API, LangChain, Vector DB",7.2,PhD in Machine Learning,West Kent
Hannah Johnson,smithbrandon@yahoo.com,(614)240-9758x161,"Vector DB, LangChain, LLM Fine-tuning, Prompt Engineering, Hugging Face, PyTorch",9.3,PhD in Machine Learning,South Donna
Daniel Horn,michael87@gonzalez-obrien.com,573.849.2657x191,"Deep Learning, RAG, LangChain, PyTorch, TensorFlow",8.2,PhD in Machine Learning,East Jeffreybury
Karen Hines,gabriela04@nguyen.com,001-869-734-7488x93388,"Hugging Face, Vector DB, TensorFlow, LangChain, Generative AI, Python, OpenAI API",6.5,PhD in Machine Learning,North James
Brenda Brown,gregory20@gillespie.com,001-239-602-6649x091,"RAG, Vector DB, LangChain, TensorFlow, Generative AI, PyTorch",9.4,M.Tech in AI,West Cynthiabury
Leslie Wilson,brycemata@kelley.info,422.153.0140,"LLM Fine-tuning, TensorFlow, Prompt Engineering, Deep Learning, Generative AI, OpenAI API, Machine Learning",7.9,M.Tech in AI,Patelstad
Kyle Beck,jason29@king.biz,9931722170,"Machine Learning, Transformers, Hugging Face, TensorFlow, LangChain, Generative AI, Vector DB",3.5,B.Sc in Data Science,Lake Johnshire
Sarah Moore,kiddjessica@yahoo.com,(708)831-7913x1292,"Generative AI, Hugging Face, TensorFlow, Deep Learning, Python, LangChain",1,B.Tech in Computer Science,Martinchester
Kevin Armstrong,jacksonkatherine@dennis.com,+1-824-578-3804x86601,"LangChain, FastAPI, Machine Learning, Deep Learning, LLM Fine-tuning, Generative AI, Vector DB",3.6,B.Sc in Data Science,Toddside
Felicia Blackwell,christinaflores@wilson.org,821-523-8931,"FastAPI, Vector DB, LangChain, Python, Deep Learning, RAG, PyTorch",6.4,M.Sc in Computer Applications,Elizabethborough
Robert Stewart,uwilliams@yahoo.com,001-993-290-9992x067,"PyTorch, Python, Machine Learning, LangChain, Hugging Face, Prompt Engineering",5,B.Sc in Data Science,Kochport
Pamela Cooley,ljohnson@hotmail.com,+1-729-896-6771x3727,"Prompt Engineering, Python, LangChain, TensorFlow, Machine Learning, LLM Fine-tuning, Transformers",8.2,B.Tech in Computer Science,Brennanborough
Cameron Anderson,timothynguyen@yahoo.com,(880)174-0214x6335,"TensorFlow, LLM Fine-tuning, Hugging Face, RAG, Prompt Engineering, Deep Learning, Transformers, OpenAI API",1.1,PhD in Machine Learning,Leemouth
Brent Edwards,pgarcia@rodgers.net,8878732501,"LangChain, FastAPI, Deep Learning, Hugging Face, Transformers, RAG, Generative AI, Python",2.8,PhD in Machine Learning,Christopherhaven
Jesse Lopez,kjohnson@hotmail.com,8219810572,"TensorFlow, OpenAI API, PyTorch, LLM Fine-tuning, FastAPI, Machine Learning, RAG",7,M.Tech in AI,Lake Brittanychester
Christopher Rodriguez,zhernandez@hotmail.com,277-817-5393x706,"LLM Fine-tuning, LangChain, Prompt Engineering, RAG, Generative AI",2.5,B.Sc in Data Science,Hendersonview
Andrew Smith,ccarrillo@hotmail.com,+1-950-023-1653x014,"RAG, PyTorch, Prompt Engineering, Machine Learning, Hugging Face, LLM Fine-tuning, Transformers, LangChain",5.3,PhD in Machine Learning,Lake Susan
Rebecca Woodard,millervictoria@yahoo.com,001-073-624-5709x9733,"Python, Deep Learning, TensorFlow, LLM Fine-tuning, Machine Learning, Transformers",4.3,M.Sc in Computer Applications,Lake Brendaside
Robert Johnson,donald08@hotmail.com,(701)140-9058x7426,"RAG, LLM Fine-tuning, Vector DB, Machine Learning, Python, LangChain, PyTorch",8.7,PhD in Machine Learning,Aprilland
Mark Schaefer,robinsonronald@gmail.com,+1-564-362-5371x0475,"Vector DB, Prompt Engineering, Generative AI, Transformers, RAG, TensorFlow, Deep Learning, LangChain",2.1,PhD in Machine Learning,Murphymouth
Daniel Greene,dean61@gmail.com,113-678-3068x216,"Deep Learning, Hugging Face, Vector DB, Machine Learning, FastAPI, PyTorch, Generative AI, Python",10,B.Tech in Computer Science,East Edwinland
Andrew Williams,bgarcia@payne-johnson.com,001-686-796-3446x99400,"FastAPI, LangChain, RAG, Generative AI, LLM Fine-tuning, Vector DB, Python, TensorFlow",3.9,M.Sc in Computer Applications,North Corey
Ricardo Navarro,harrisjohn@reynolds.net,9799969306,"Python, Deep Learning, FastAPI, Machine Learning, OpenAI API, RAG",8.7,B.Tech in Computer Science,North Annamouth
Nathan House,xking@valdez-phillips.com,535-165-6156x36526,"Transformers, Python, LLM Fine-tuning, OpenAI API, Vector DB",2.9,M.Tech in AI,West Jeffrey
Brenda Rangel,michael43@sheppard.com,-10473,"Deep Learning, Vector DB, OpenAI API, PyTorch, Transformers, Python",4.1,B.Sc in Data Science,Port Ryanville
Scott Wilson,nlopez@jackson-edwards.info,(280)298-0254,"Generative AI, FastAPI, Python, LLM Fine-tuning, TensorFlow, Hugging Face",4.9,PhD in Machine Learning,New Nancyfurt
Clayton Baker,richardbass@miller.net,(377)695-8286x91478,"Vector DB, Deep Learning, PyTorch, TensorFlow, LangChain, LLM Fine-tuning",7.9,PhD in Machine Learning,South Georgebury
Michael Lopez,gkennedy@gmail.com,-6761,"Transformers, TensorFlow, Deep Learning, PyTorch, RAG, Hugging Face, Python, OpenAI API",6,M.Tech in AI,Port Jeremiah
Daniel Collins,zstark@yahoo.com,001-684-374-2828x06725,"PyTorch, Deep Learning, LangChain, Prompt Engineering, Generative AI, TensorFlow, LLM Fine-tuning",9.9,PhD in Machine Learning,Morganburgh
Mary Thompson,meganjones@ramirez.org,497-525-8603,"PyTorch, Vector DB, Machine Learning, Hugging Face, RAG, Transformers, TensorFlow, Deep Learning",4.5,B.Sc in Data Science,East Brian
Kim Smith,morenolisa@hall-petersen.info,957.293.3576,"Vector DB, OpenAI API, LangChain, Machine Learning, LLM Fine-tuning, Python, FastAPI, Prompt Engineering",4.4,M.Tech in AI,Williambury
Alexander Martinez,cruzmonica@yahoo.com,-7280,"LangChain, PyTorch, Machine Learning, Vector DB, Prompt Engineering, FastAPI, TensorFlow, Generative AI",4.1,M.Tech in AI,East Nicholas
Tamara Robinson,courtney33@gmail.com,(111)179-4096,"Generative AI, Machine Learning, PyTorch, LLM Fine-tuning, LangChain, FastAPI",4.1,B.Sc in Data Science,Bennettport
Scott Christian,figueroajohn@yahoo.com,247-579-8699x6243,"Prompt Engineering, LLM Fine-tuning, Machine Learning, LangChain, FastAPI, Deep Learning, Hugging Face, OpenAI API",4.1,B.Tech in Computer Science,Peterschester
Abigail Preston,lindsaywhite@hotmail.com,792-634-6405x5426,"Deep Learning, Vector DB, Machine Learning, TensorFlow, LLM Fine-tuning, Generative AI, Hugging Face",7.8,M.Sc in Computer Applications,Tapiaport
Emily Ayala,brittany82@reed.com,(646)313-8683,"FastAPI, Transformers, Prompt Engineering, LangChain, Hugging Face, TensorFlow, Python",4.8,M.Tech in AI,West Mark
Tiffany Richardson,istewart@dyer.com,900-838-9671x34120,"LLM Fine-tuning, Generative AI, FastAPI, Machine Learning, Vector DB",3.7,M.Sc in Computer Applications,West Derrick
Charles Brown,fvasquez@yahoo.com,581.742.5038,"Generative AI, LLM Fine-tuning, LangChain, Transformers, PyTorch",7.7,B.Tech in Computer Science,Port Darrell
Robert Howe,william64@yahoo.com,884-348-9536x322,"Machine Learning, Prompt Engineering, Python, Transformers, LangChain",7.2,B.Sc in Data Science,Michaeltown
Angela Horne,kimberlyharris@hotmail.com,+1-141-446-6150x871,"PyTorch, RAG, Vector DB, Machine Learning, LLM Fine-tuning, Python, FastAPI",6.4,PhD in Machine Learning,Stacyshire
Joseph Steele,wendymiller@hughes.biz,830-625-6498,"OpenAI API, Hugging Face, Vector DB, LLM Fine-tuning, Machine Learning, Transformers, TensorFlow",3.7,B.Sc in Data Science,East Shirleyhaven
Wendy Collins,xdorsey@newman.net,+1-063-005-7241x3126,"Machine Learning, Python, OpenAI API, PyTorch, LLM Fine-tuning, Hugging Face, LangChain, TensorFlow",8.5,M.Sc in Computer Applications,West Richard
Donald Griffin,eholland@ward.net,-6069,"RAG, Transformers, Python, FastAPI, LLM Fine-tuning, LangChain, TensorFlow",6.1,M.Sc in Computer Applications,South Andrewport
Frank Wallace,annebradshaw@whitaker.com,+1-554-420-2568x8637,"FastAPI, RAG, Transformers, OpenAI API, Deep Learning",6.2,B.Tech in Computer Science,Ashleyton
Jacob Williams,erinarnold@hotmail.com,021.684.0919x368,"Vector DB, Machine Learning, Prompt Engineering, LangChain, Transformers, FastAPI",2.1,M.Tech in AI,Rivasport
Tammy Byrd,rebeccastewart@stevenson.com,591.195.4918x0170,"Transformers, FastAPI, Prompt Engineering, Machine Learning, LangChain, LLM Fine-tuning, Generative AI",2.1,PhD in Machine Learning,Nguyenbury
Robert Clark,cynthia93@yahoo.com,078.392.3592x55290,"Python, Transformers, RAG, Hugging Face, LLM Fine-tuning, Generative AI, LangChain, PyTorch",3.1,B.Sc in Data Science,North Denise
John Chang,ngarcia@gmail.com,+1-367-967-7514x97273,"PyTorch, OpenAI API, Vector DB, Generative AI, Prompt Engineering",9.1,M.Sc in Computer Applications,East Taramouth
Shawn Williams,louis41@yahoo.com,(717)247-4910,"TensorFlow, Generative AI, RAG, Deep Learning, FastAPI, PyTorch, LLM Fine-tuning",9.7,M.Sc in Computer Applications,West Amanda
Ellen Wolf,melissa60@gmail.com,001-915-758-3820,"TensorFlow, Vector DB, RAG, Machine Learning, PyTorch, Hugging Face, Python, Generative AI",8.4,B.Tech in Computer Science,Smithland
Tiffany Schneider,sean93@burgess-jones.biz,+1-124-915-1483x51450,"LangChain, Deep Learning, FastAPI, Hugging Face, TensorFlow, RAG",5.9,M.Sc in Computer Applications,Mcclureborough
Wayne Williams,joseph50@shepard.com,-2580,"Prompt Engineering, FastAPI, Vector DB, OpenAI API, Machine Learning",8.7,M.Tech in AI,East Caleb
Derek Fry,ecox@gmail.com,955-691-5042,"TensorFlow, Python, RAG, Vector DB, FastAPI, PyTorch",8.6,PhD in Machine Learning,North Douglasfort
Gina Smith,reeseaudrey@yahoo.com,905.102.1032x107,"FastAPI, TensorFlow, Vector DB, LangChain, Deep Learning, OpenAI API",8.8,B.Sc in Data Science,Ericview
Roy Wise,idiaz@yahoo.com,(428)864-5642x24492,"RAG, Vector DB, OpenAI API, Prompt Engineering, Hugging Face",2.5,B.Tech in Computer Science,West Carol
Melissa Lopez,angela26@jenkins-baxter.com,+1-407-364-2365x693,"Machine Learning, PyTorch, LangChain, OpenAI API, RAG, Generative AI",3.1,M.Sc in Computer Applications,West Emilychester
Sue Serrano,brianhill@hotmail.com,(980)926-3637,"OpenAI API, Python, PyTorch, Machine Learning, LLM Fine-tuning, LangChain",1.1,B.Tech in Computer Science,Deanton
Kristen Wilcox,yhuff@gmail.com,(212)986-7916x5528,"LLM Fine-tuning, Generative AI, Machine Learning, TensorFlow, Prompt Engineering, Hugging Face, RAG",7.1,B.Tech in Computer Science,Millerton
David Ellison DDS,abigaillawson@matthews.com,001-877-813-0094x90425,"Machine Learning, LLM Fine-tuning, OpenAI API, PyTorch, Vector DB, Generative AI, Python",9.2,B.Sc in Data Science,South Ann
Taylor Coleman,christopher80@porter.com,001-302-309-1079,"LLM Fine-tuning, Transformers, Python, Hugging Face, RAG, OpenAI API, TensorFlow",2.3,B.Sc in Data Science,Gonzalezberg
Nancy Watts,warrenkimberly@gmail.com,233-307-0783,"Hugging Face, Deep Learning, Python, LLM Fine-tuning, FastAPI, LangChain, Transformers, PyTorch",7.6,M.Sc in Computer Applications,North Amyborough
Kristen Davis,matthew74@hotmail.com,497.140.9605x6871,"Vector DB, PyTorch, LangChain, Deep Learning, Transformers, RAG",3.5,PhD in Machine Learning,North Cassie
Kimberly Randolph,thomassarah@lucas.com,827.959.4076,"Python, TensorFlow, Hugging Face, Deep Learning, PyTorch, LangChain, Vector DB, Generative AI",2.7,M.Tech in AI,East Chad
Bryan Wang,kathrynmcdonald@gonzalez.com,001-487-404-5235x65347,"Hugging Face, Generative AI, LangChain, LLM Fine-tuning, RAG, Vector DB",5.9,B.Tech in Computer Science,Jillianview
Benjamin Evans,qsandoval@hotmail.com,681-579-2050x1905,"Python, FastAPI, Machine Learning, Transformers, Hugging Face",6.7,B.Tech in Computer Science,West Curtis
Carrie Fisher,brooke56@savage.biz,-4836,"Deep Learning, Hugging Face, Transformers, Generative AI, FastAPI",5.6,B.Sc in Data Science,Jacobland
Brenda Davis,sharon49@ortega.com,389.594.8602x965,"Hugging Face, Deep Learning, LangChain, PyTorch, Python, Transformers, FastAPI, RAG",8.5,M.Tech in AI,North Jenniferville
Bryan Garza,heather62@wood.org,067-870-1702x9742,"Vector DB, Generative AI, Hugging Face, Transformers, Prompt Engineering, Machine Learning",2.7,B.Sc in Data Science,South Kenneth
Mary Jackson,robertsonrebecca@gmail.com,994.059.3183,"LLM Fine-tuning, OpenAI API, Vector DB, RAG, Deep Learning, TensorFlow",5.8,B.Tech in Computer Science,Joshuamouth
Kristen Bruce,brussell@yahoo.com,001-364-496-2995,"Deep Learning, OpenAI API, Python, LLM Fine-tuning, Machine Learning, PyTorch, Generative AI",2,M.Sc in Computer Applications,East Jeremyton
Thomas Lane,qgarcia@peters.org,(829)355-3426,"OpenAI API, FastAPI, LangChain, Generative AI, Machine Learning",7.6,M.Sc in Computer Applications,Ericbury
Sherri York,beth44@gmail.com,4047810589,"TensorFlow, PyTorch, LangChain, Vector DB, Generative AI, Machine Learning",1.8,PhD in Machine Learning,West Jeffport
Bryan Smith,patrickstuart@hall.net,001-783-516-7312x81876,"Vector DB, PyTorch, LangChain, Python, TensorFlow, FastAPI",3.7,M.Tech in AI,Heathfort
Angela Morgan,scolon@hotmail.com,(937)168-7151x641,"TensorFlow, Transformers, PyTorch, OpenAI API, Python, LLM Fine-tuning, Generative AI, RAG",4.4,PhD in Machine Learning,South Johnbury
Meagan Murray,zhill@gardner.biz,(962)737-7152,"OpenAI API, Machine Learning, RAG, Deep Learning, Vector DB, Hugging Face, LangChain",6.3,PhD in Machine Learning,Clarenceview
Nicholas Morrison,jennifer66@gmail.com,001-584-038-7975x440,"LLM Fine-tuning, Hugging Face, Vector DB, FastAPI, LangChain, OpenAI API",4.9,M.Sc in Computer Applications,East Melissa
Robert Livingston,stonejeremy@gmail.com,518-665-7266,"Transformers, OpenAI API, FastAPI, Hugging Face, Vector DB, RAG, LangChain",6.6,B.Sc in Data Science,Lake Jamie
Andrew Davis,maryreese@clark.com,(569)540-0992x9395,"TensorFlow, Deep Learning, Python, FastAPI, Hugging Face, LangChain, Transformers",3.4,PhD in Machine Learning,New Zachary
Barry Morris,jeffrey44@davis.net,6810790974,"OpenAI API, TensorFlow, Python, FastAPI, Vector DB, Prompt Engineering, Deep Learning, PyTorch",3,M.Sc in Computer Applications,Lake Laurenbury
Nicole Acosta,tphelps@meyers.info,(469)806-0944x3882,"Vector DB, LangChain, OpenAI API, Generative AI, FastAPI",7.1,M.Sc in Computer Applications,Lake Johnmouth
Matthew Warren,elizabeth13@yahoo.com,001-746-034-6164x8449,"Machine Learning, Hugging Face, Vector DB, LLM Fine-tuning, TensorFlow, FastAPI, Generative AI",8.3,PhD in Machine Learning,Marymouth
Sheena Scott,dandrade@hotmail.com,001-274-759-5344,"Transformers, Generative AI, FastAPI, PyTorch, Machine Learning, Vector DB, Hugging Face",5.5,M.Sc in Computer Applications,Vincentland
Tracy Mosley,angela80@casey.com,-5046,"Hugging Face, FastAPI, Prompt Engineering, Python, Generative AI, Transformers",2,PhD in Machine Learning,West Paula
Amanda Nguyen,xwhitehead@robinson-davis.biz,+1-724-600-7202x882,"Deep Learning, Prompt Engineering, Vector DB, Transformers, Hugging Face, Generative AI",6.4,B.Sc in Data Science,Stanleymouth
Molly Howard,michellewilliams@gmail.com,593.961.6097x913,"Deep Learning, OpenAI API, TensorFlow, FastAPI, PyTorch, Generative AI, Prompt Engineering, RAG",4.8,B.Tech in Computer Science,Acostastad
Jose Doyle,taylorkelly@downs.info,780-864-7379,"PyTorch, Generative AI, Deep Learning, Python, Vector DB, Transformers",9.4,B.Tech in Computer Science,Port Karen
Randy Perez,eduardoroach@hotmail.com,001-590-522-0778x65780,"Transformers, TensorFlow, RAG, Vector DB, LLM Fine-tuning",4.2,M.Sc in Computer Applications,Lake Ricardo
Sarah Lopez,warnerelizabeth@gmail.com,018.203.1682,"PyTorch, Transformers, TensorFlow, RAG, LLM Fine-tuning, Generative AI",5.3,M.Sc in Computer Applications,Riveraland
Audrey Wright,cperez@zhang.info,504-356-0860x08043,"LangChain, Vector DB, Python, Deep Learning, Machine Learning, TensorFlow, Prompt Engineering",5.9,B.Tech in Computer Science,Underwoodborough
Aaron Wise,ghood@brown.net,695-884-5941x06053,"TensorFlow, LangChain, Deep Learning, Vector DB, Generative AI, Machine Learning",6.9,PhD in Machine Learning,Loriport
Justin Moore,gregorylee@rogers.net,+1-930-822-1627x595,"LLM Fine-tuning, Hugging Face, Deep Learning, OpenAI API, LangChain",6.8,M.Sc in Computer Applications,West Heather
Brittany Clayton,zvalentine@gmail.com,-7149,"PyTorch, OpenAI API, LLM Fine-tuning, Python, Deep Learning, Generative AI, Hugging Face",4.2,B.Tech in Computer Science,South Marymouth
Justin Jacobs,esimmons@hotmail.com,961-541-7407,"Transformers, Vector DB, FastAPI, Generative AI, OpenAI API, PyTorch, Deep Learning",5.5,M.Tech in AI,North Tiffany
Michael Weaver,connie11@wallace.org,-10656,"Hugging Face, LLM Fine-tuning, Machine Learning, Vector DB, Generative AI, TensorFlow",4.3,B.Sc in Data Science,Charlesmouth
Debra Garcia,arnoldstephanie@green-george.com,498.522.5532x33657,"Transformers, Hugging Face, RAG, TensorFlow, Generative AI",8.7,PhD in Machine Learning,Port Andrew
