Applicant name,Email,Phone Number,Expertise,Experience,Academic Background,Location
Jamie Jones,boydnathan@yahoo.com,241-483-4204,"OpenAI API, LLM Fine-tuning, Machine Learning, Hugging Face, PyTorch, FastAPI, RAG, Vector DB",2,B.Tech in Computer Science,Bethanyland
Stefanie Skinner,tamaramoore@morales-farrell.com,+1-106-038-9768x337,"PyTorch, Hugging Face, Generative AI, Vector DB, LangChain, OpenAI API, Prompt Engineering",1.5,M.Tech in AI,North Jessicaville
Jade Boyd,jacksonfrances@lopez-riley.com,001-341-662-8698x233,"Prompt Engineering, FastAPI, Transformers, Hugging Face, PyTorch, LangChain, Generative AI",5,PhD in Machine Learning,East Cassandra
Scott Scott,darrell47@melton-hernandez.com,-7264,"Hugging Face, Vector DB, OpenAI API, Python, Machine Learning",2.6,B.Sc in Data Science,Michelleshire
Nicholas Mathis,fvega@gmail.com,452-005-4367x79863,"Transformers, LangChain, Machine Learning, RAG, LLM Fine-tuning, PyTorch",9.8,B.Sc in Data Science,Juanburgh
Rachel Brown,usmith@estrada.com,460-320-6140x358,"FastAPI, Hugging Face, PyTorch, Machine Learning, Prompt Engineering, Transformers, Vector DB",9.3,M.Sc in Computer Applications,Joanport
Jaime Chambers,laura03@gmail.com,001-158-286-4481,"Hugging Face, LLM Fine-tuning, OpenAI API, LangChain, Deep Learning, PyTorch, Python, Prompt Engineering",2.4,PhD in Machine Learning,Rossport
Denise Johnson,merrittashley@stephens.com,424.535.8825x9583,"FastAPI, RAG, LLM Fine-tuning, OpenAI API, PyTorch",2.3,M.Tech in AI,West Vanessa
Leslie Beck,shorton@hotmail.com,991.716.7895x548,"LangChain, FastAPI, LLM Fine-tuning, Machine Learning, Hugging Face, RAG, Generative AI, PyTorch",7,M.Sc in Computer Applications,Melissastad
Tanya Taylor,hillvictoria@archer.com,9638320486,"Python, Transformers, LangChain, FastAPI, Prompt Engineering, RAG, PyTorch",9.6,M.Sc in Computer Applications,New Nicole
Jason Banks,carolyn72@fuller.com,384.453.3508,"Transformers, Prompt Engineering, RAG, Vector DB, LangChain",8.4,PhD in Machine Learning,South Richard
Stephanie Clarke,wsmith@tucker.com,001-174-661-1835x148,"Machine Learning, Prompt Engineering, LangChain, Python, Deep Learning, PyTorch, FastAPI",6.8,B.Sc in Data Science,Mendozashire
Dawn Ramirez,william56@gmail.com,026-460-6468,"Deep Learning, FastAPI, PyTorch, RAG, OpenAI API",7.7,M.Sc in Computer Applications,Lake Heidiport
Stephanie Castillo,danny33@hotmail.com,(109)461-9385x28964,"Machine Learning, Vector DB, Hugging Face, Generative AI, PyTorch",1.8,B.Sc in Data Science,New Davidmouth
Olivia Ball,mistycarter@french-moyer.net,507.256.4469,"Python, Generative AI, PyTorch, Vector DB, Transformers",5.3,PhD in Machine Learning,Port Michaelhaven
Jeffrey Torres,kevinjohnson@hotmail.com,001-396-457-7492x2026,"PyTorch, RAG, Generative AI, FastAPI, Transformers, Prompt Engineering, OpenAI API",2.5,M.Sc in Computer Applications,Port Scottmouth
Tyler Carrillo,johnsonkathryn@gmail.com,(747)570-8494,"Deep Learning, TensorFlow, Python, OpenAI API, Transformers, Vector DB",2,M.Sc in Computer Applications,Francoside
Alex Curry,sarah29@gmail.com,251.622.2744x524,"RAG, LangChain, Python, Vector DB, PyTorch",4.2,B.Tech in Computer Science,Normanbury
Jeffrey Spears,blake44@mclaughlin-proctor.com,639.903.9572,"Deep Learning, LLM Fine-tuning, FastAPI, Prompt Engineering, Transformers, Machine Learning",3.3,PhD in Machine Learning,Port Erictown
Todd Castaneda,dmartinez@gmail.com,(698)204-4518x16777,"LangChain, Prompt Engineering, FastAPI, RAG, Deep Learning, Transformers",6.9,PhD in Machine Learning,New Nicholasville
Patricia Lara,danielblackwell@wallace.com,866.131.3029,"Prompt Engineering, OpenAI API, FastAPI, TensorFlow, Vector DB",6.1,PhD in Machine Learning,Jeffreychester
Michael Howell,teresa97@robinson.com,177922630,"RAG, OpenAI API, PyTorch, Prompt Engineering, LLM Fine-tuning, LangChain, Vector DB",2.9,B.Sc in Data Science,East Karen
Megan Lee,samuel36@yahoo.com,706-091-0618,"Generative AI, LangChain, OpenAI API, RAG, Deep Learning, Python, Transformers, TensorFlow",7.5,B.Tech in Computer Science,Deanland
Mallory Pratt,portersabrina@yahoo.com,468.329.0417x65878,"Hugging Face, RAG, Generative AI, PyTorch, OpenAI API, TensorFlow",7.1,M.Sc in Computer Applications,Adrianborough
Gordon Guzman,qcarney@gmail.com,458-091-1715x19609,"Vector DB, Machine Learning, Transformers, FastAPI, PyTorch, Python",2.7,B.Tech in Computer Science,South Linda
David Elliott,ortegamichael@alexander-long.com,845.263.5932,"Prompt Engineering, RAG, Vector DB, Machine Learning, Deep Learning, Transformers, OpenAI API, Generative AI",8.6,B.Sc in Data Science,New Desiree
Dana Monroe,anthony39@yahoo.com,+1-962-794-1547x12485,"PyTorch, Machine Learning, Prompt Engineering, TensorFlow, RAG",7.4,B.Tech in Computer Science,Lake Janet
Barbara Frederick,oconnorlaurie@ortiz.org,(151)748-0638x65948,"Transformers, LLM Fine-tuning, FastAPI, OpenAI API, Prompt Engineering",1.2,M.Sc in Computer Applications,South Joseph
Anthony Michael,isharp@yahoo.com,889-339-5492x359,"Vector DB, Hugging Face, Machine Learning, PyTorch, Python",5.9,M.Tech in AI,South Elijahville
Christopher Berry,kellercharles@simmons.com,-6685,"Prompt Engineering, PyTorch, RAG, Transformers, LangChain, Machine Learning, TensorFlow",2.4,PhD in Machine Learning,Frankton
Brittany Barajas,huynhsarah@white-james.biz,-2126,"Machine Learning, OpenAI API, FastAPI, Python, Prompt Engineering, Transformers",7.3,M.Tech in AI,Lake Sarahville
David Maxwell,allisonayers@banks.info,(342)118-4836x754,"Prompt Engineering, Transformers, Deep Learning, Machine Learning, Hugging Face, LLM Fine-tuning, Vector DB, Python",9.4,PhD in Machine Learning,Lake Robinshire
Cindy Rogers,vmyers@hotmail.com,755-841-4738,"Hugging Face, Generative AI, Vector DB, Machine Learning, FastAPI, RAG, Deep Learning, Python",2.9,M.Tech in AI,Port Petertown
Tracy Bell,michael92@navarro-rodgers.com,746-382-2321,"OpenAI API, RAG, Deep Learning, Machine Learning, LLM Fine-tuning, LangChain, Generative AI",9.1,B.Tech in Computer Science,Austinfurt
Scott Cruz,morsesean@petersen-gardner.com,314-533-8981x644,"Vector DB, TensorFlow, Hugging Face, Python, Deep Learning, LLM Fine-tuning",1.1,M.Tech in AI,Robinsontown
Michael Pena,valdezkelsey@smith.org,+1-229-451-3495x366,"RAG, TensorFlow, Transformers, LLM Fine-tuning, Generative AI, Deep Learning, Vector DB, FastAPI",8,B.Sc in Data Science,West Michelleshire
Jennifer Mendez,justinbutler@nolan.com,(399)835-3546,"Machine Learning, Generative AI, Transformers, Python, Prompt Engineering, Deep Learning, OpenAI API, TensorFlow",9.6,M.Tech in AI,North Markshire
Ms. Amber Hughes,lambglenn@torres.com,537-863-9081,"PyTorch, LLM Fine-tuning, Hugging Face, TensorFlow, RAG, Vector DB, Transformers",4.8,M.Sc in Computer Applications,Lake Carolyn
Dennis Dyer,natalie17@hotmail.com,+1-240-141-2315x73690,"Hugging Face, Prompt Engineering, FastAPI, LLM Fine-tuning, RAG, Deep Learning, Vector DB, TensorFlow",5.1,M.Sc in Computer Applications,West Victoria
Laura Mcdowell,matthew23@walker-kemp.org,-6616,"Prompt Engineering, LangChain, Generative AI, PyTorch, Deep Learning, RAG",2.9,M.Tech in AI,New Heidi
Jennifer Lewis,kmoreno@kane.org,+1-302-576-5587x7802,"RAG, Deep Learning, PyTorch, Prompt Engineering, Hugging Face, Python, Generative AI, Machine Learning",3.3,M.Tech in AI,Kevinchester
Emily Hodge,cindy24@love.com,568.917.0625x4757,"Vector DB, LLM Fine-tuning, PyTorch, Python, Prompt Engineering, OpenAI API, LangChain, Transformers",1.4,B.Sc in Data Science,Martineztown
Dominique Santos,cynthia89@miller.com,741.682.7707x9233,"Deep Learning, TensorFlow, Machine Learning, RAG, Transformers, Hugging Face, FastAPI, LLM Fine-tuning",2.6,PhD in Machine Learning,New Shawnland
Anna Moody,brian52@orr-lee.com,001-061-698-9132x689,"Vector DB, Machine Learning, Generative AI, Python, OpenAI API, Hugging Face",7.5,PhD in Machine Learning,West Tim
Chelsea Kane,hburke@hotmail.com,6270200131,"Machine Learning, Prompt Engineering, TensorFlow, Vector DB, PyTorch, LangChain, Python, Transformers",6.9,M.Tech in AI,New Codytown
Steven Jones,maryarroyo@yahoo.com,001-541-020-5567x346,"Machine Learning, TensorFlow, RAG, FastAPI, Hugging Face, Transformers, Vector DB",8.7,B.Sc in Data Science,Derekview
Jonathan Tyler,bethany22@davies.info,-2701,"LangChain, Machine Learning, Vector DB, Prompt Engineering, LLM Fine-tuning",2.2,B.Tech in Computer Science,West Ryanborough
Jacqueline Burgess,andrea74@kennedy-choi.net,+1-242-278-8460x05604,"LLM Fine-tuning, PyTorch, Prompt Engineering, Deep Learning, Vector DB",3.5,B.Sc in Data Science,Wadeside
Jared Mitchell,ashleywagner@hotmail.com,643-229-9517,"OpenAI API, LangChain, FastAPI, Machine Learning, Vector DB, TensorFlow",7.2,M.Sc in Computer Applications,Gabriellefort
Andrew Acosta,fpeterson@little-trevino.biz,367.372.1308x62572,"Hugging Face, TensorFlow, Deep Learning, OpenAI API, FastAPI, LLM Fine-tuning, PyTorch, Machine Learning",1,PhD in Machine Learning,Ronaldfurt
Erin Stevens,umay@levy-long.com,(054)880-9902x77688,"Prompt Engineering, LLM Fine-tuning, Vector DB, Python, Deep Learning, LangChain, Generative AI",8.7,B.Tech in Computer Science,Fisherborough
Michelle Jones,janetgrimes@gmail.com,(614)029-3131,"Deep Learning, Machine Learning, PyTorch, Hugging Face, FastAPI",4.2,B.Sc in Data Science,Mcgeemouth
Stephanie Moore,blakeholt@yahoo.com,667.534.0771,"RAG, Prompt Engineering, Transformers, Machine Learning, Generative AI, Deep Learning, PyTorch",8.6,M.Sc in Computer Applications,West Jason
Michael Mccoy,crystalpark@hotmail.com,077.305.2389,"TensorFlow, Vector DB, Machine Learning, FastAPI, Deep Learning, Generative AI, Python",3.5,PhD in Machine Learning,Katrinafurt
Emily Sanchez,margaretbriggs@benjamin.info,144.909.3424x19696,"Prompt Engineering, PyTorch, Python, RAG, Hugging Face",1.4,M.Tech in AI,Kellyville
Denise Fleming,dwoods@gmail.com,366.692.4974x414,"LangChain, Vector DB, Transformers, FastAPI, TensorFlow, Prompt Engineering, RAG, Machine Learning",5.3,M.Tech in AI,West Sandraland
Angela Gordon,james85@gmail.com,(544)304-1006,"Python, PyTorch, TensorFlow, Vector DB, LLM Fine-tuning, Transformers, FastAPI, Machine Learning",3.4,B.Tech in Computer Science,South Timothy
Douglas Bass,susanlarson@figueroa.com,947.716.6970,"OpenAI API, TensorFlow, LangChain, Machine Learning, Prompt Engineering, FastAPI",4.2,PhD in Machine Learning,Jessicashire
James Price,davidthompson@gmail.com,001-044-256-7371x9819,"FastAPI, Vector DB, PyTorch, RAG, Python, Deep Learning",8.1,M.Tech in AI,Millerton
Sarah Vang,anna16@hotmail.com,001-389-915-5100x14849,"FastAPI, TensorFlow, LangChain, LLM Fine-tuning, Prompt Engineering, Generative AI, Hugging Face, Transformers",3.8,M.Sc in Computer Applications,South Richard
Matthew Davis,ynelson@yahoo.com,(162)984-4118x26707,"Vector DB, TensorFlow, Python, FastAPI, OpenAI API",7.8,PhD in Machine Learning,East Daniel
Kelsey Brown,victoriamason@yahoo.com,7162434726,"OpenAI API, Vector DB, Python, Hugging Face, LLM Fine-tuning",8.3,PhD in Machine Learning,Morrisbury
Terry Miller,owinters@yahoo.com,(813)761-7124x9110,"RAG, Prompt Engineering, Deep Learning, Vector DB, Generative AI, OpenAI API, Python",3.7,PhD in Machine Learning,New Amber
Elizabeth Johnson,douglaswalker@gmail.com,(483)095-0718x597,"TensorFlow, Hugging Face, Generative AI, Vector DB, Transformers",8,M.Sc in Computer Applications,Lake Destinybury
Natasha Anderson,taylordavid@anderson-frazier.com,4987348313,"Vector DB, PyTorch, Deep Learning, Machine Learning, FastAPI",3.7,PhD in Machine Learning,Smithton
Meghan Fitzgerald,andersonalec@becker.com,750.973.0750x9430,"Deep Learning, FastAPI, Machine Learning, LLM Fine-tuning, Python",3,M.Tech in AI,South Laurenville
Taylor Zhang,mmarshall@montgomery.com,(627)751-7162,"FastAPI, TensorFlow, Vector DB, Transformers, Generative AI",5.9,M.Sc in Computer Applications,Brianhaven
Diana Carlson,paulasmith@bolton.com,726-460-3410x8161,"OpenAI API, Prompt Engineering, Generative AI, Transformers, Hugging Face",5.5,B.Sc in Data Science,Susanland
April Oconnor,brianrandolph@lamb.biz,001-312-960-4488,"Machine Learning, LangChain, Hugging Face, Python, TensorFlow, Generative AI",9.2,M.Sc in Computer Applications,North John
Cory Morris,william20@douglas.com,265.637.2253x45856,"Prompt Engineering, OpenAI API, Python, Generative AI, Deep Learning, LLM Fine-tuning, LangChain, FastAPI",6.4,M.Tech in AI,East Hayden
Jason Sanchez,joseph69@gmail.com,2476178921,"LLM Fine-tuning, Transformers, OpenAI API, Machine Learning, Deep Learning, Prompt Engineering",2.7,M.Sc in Computer Applications,North Paigetown
William Ryan,fgood@arnold.com,666.554.4835x629,"RAG, Deep Learning, Vector DB, Generative AI, Hugging Face",8.1,PhD in Machine Learning,Maloneport
Bryan Watkins,smithamanda@yahoo.com,4567501750,"Hugging Face, TensorFlow, Deep Learning, Machine Learning, Vector DB, FastAPI",6.3,PhD in Machine Learning,East Krystalland
Thomas Miller,cortezpaula@hotmail.com,(693)222-5243,"Deep Learning, LangChain, Machine Learning, Python, Vector DB",5.3,M.Tech in AI,Kevinmouth
Ashley Murphy,ihoover@harris-carr.com,194.889.7819,"Hugging Face, Prompt Engineering, FastAPI, Machine Learning, Python, Deep Learning, Generative AI",1.3,PhD in Machine Learning,New Christy
Melissa Hart,brownlawrence@ponce-hamilton.biz,777-789-4542,"PyTorch, TensorFlow, FastAPI, OpenAI API, Deep Learning, Vector DB",4.7,B.Tech in Computer Science,Griffithfurt
Adam Thompson,alan59@thomas.org,473.466.7997,"Prompt Engineering, LLM Fine-tuning, Machine Learning, Vector DB, LangChain, FastAPI, Deep Learning",2.2,B.Sc in Data Science,Amyland
Steven Lee,brownhannah@gmail.com,+1-533-522-2664x9222,"Generative AI, PyTorch, FastAPI, Vector DB, Hugging Face, Prompt Engineering",3.6,B.Tech in Computer Science,Warrenberg
William Hall,thomas95@campbell.net,432-743-5209x229,"Hugging Face, Machine Learning, RAG, Transformers, Generative AI, TensorFlow, Python",7.2,M.Sc in Computer Applications,Port Douglas
John Anderson,clynn@smith-clark.com,509.015.4725,"Generative AI, OpenAI API, Transformers, Deep Learning, FastAPI, Hugging Face, LLM Fine-tuning",4,M.Sc in Computer Applications,Port Scott
Brandon Nichols,ydiaz@gmail.com,099-766-1225x8879,"OpenAI API, Generative AI, LangChain, Hugging Face, Transformers, TensorFlow, LLM Fine-tuning",1.4,PhD in Machine Learning,Hallside
Michael Stewart,lyonsmelanie@smith.com,(849)609-3213x9144,"Vector DB, TensorFlow, LangChain, Deep Learning, Prompt Engineering, Machine Learning",1.5,B.Tech in Computer Science,Cruzshire
Eric Moody,marksmith@clark.com,001-128-723-5804x9495,"RAG, Generative AI, TensorFlow, Hugging Face, Machine Learning, Vector DB",9.6,B.Tech in Computer Science,Cohenhaven
Rebekah Sparks,fstone@cook.net,165.277.4234x22334,"Generative AI, TensorFlow, Python, LangChain, FastAPI, Vector DB, Deep Learning",9.3,M.Tech in AI,Ericfort
Carl Wong,sarah54@gmail.com,451-972-7449,"LLM Fine-tuning, Transformers, Hugging Face, LangChain, FastAPI, Deep Learning, Python, Prompt Engineering",4.7,B.Tech in Computer Science,Kellermouth
Joseph Hall,santiagobrenda@freeman.info,773-983-0781x085,"LLM Fine-tuning, Vector DB, LangChain, Prompt Engineering, Transformers, RAG, FastAPI",4.6,B.Tech in Computer Science,West Jeffery
Jennifer Smith,leachgabriel@hotmail.com,945.012.0686,"Machine Learning, Vector DB, Prompt Engineering, Generative AI, Hugging Face, PyTorch, RAG",4,M.Sc in Computer Applications,Amandabury
Ariana Wallace,anthony93@holder.biz,(915)159-1835x8877,"PyTorch, TensorFlow, Generative AI, OpenAI API, LangChain",9.2,M.Sc in Computer Applications,Rebeccaton
Emily Mcguire,robertgibson@hill.biz,001-180-523-5551,"Deep Learning, FastAPI, Transformers, Hugging Face, Machine Learning, OpenAI API",3,B.Tech in Computer Science,Christopherstad
Andrew Snyder,markhurst@lopez.com,388-002-5382x22950,"Python, Transformers, Generative AI, OpenAI API, Machine Learning",8.3,B.Tech in Computer Science,Angelaborough
Amanda Patel DDS,richardsonbrian@trujillo-sullivan.info,242-808-4333,"Deep Learning, Python, Hugging Face, LangChain, Vector DB",4.9,M.Tech in AI,Port Lance
Brian Bradley,tom08@shelton.com,001-673-905-6047x124,"Hugging Face, PyTorch, OpenAI API, Deep Learning, Python, FastAPI",1.5,M.Tech in AI,East Katie
Stephanie Strickland,zjackson@yahoo.com,945.923.7988x64372,"RAG, LLM Fine-tuning, OpenAI API, Vector DB, Hugging Face, FastAPI, LangChain",9.5,B.Sc in Data Science,North Tricia
Jose Martinez,kennethmartin@cook.net,(501)976-1289,"FastAPI, LangChain, LLM Fine-tuning, TensorFlow, Python, Vector DB, Generative AI",6,PhD in Machine Learning,Port Dakota
Michelle Williams,tiffany50@gmail.com,052-445-7860,"Prompt Engineering, TensorFlow, RAG, Machine Learning, Transformers",1.7,M.Sc in Computer Applications,West Deborah
Dennis Crawford,jamespadilla@hernandez.com,-6520,"Hugging Face, Deep Learning, TensorFlow, Machine Learning, LangChain, PyTorch",2.9,B.Tech in Computer Science,Turnerberg
Penny Gillespie,yli@ford-willis.net,001-286-660-2330x908,"Prompt Engineering, PyTorch, Python, LangChain, RAG, Generative AI",8.2,PhD in Machine Learning,North Maureenfort
Ashlee Patel,hayesrobin@yahoo.com,+1-657-578-0179x48501,"LLM Fine-tuning, Vector DB, RAG, Hugging Face, OpenAI API, Python, Prompt Engineering, Transformers",4.4,B.Tech in Computer Science,Michaelborough
Arthur Hamilton,rachael38@casey.net,(065)471-8659x70046,"RAG, OpenAI API, LLM Fine-tuning, Generative AI, Hugging Face, Deep Learning",5.4,PhD in Machine Learning,Vickieland
Eileen Davis,robertlewis@yahoo.com,+1-983-881-6990x3723,"PyTorch, Deep Learning, LLM Fine-tuning, RAG, Prompt Engineering",8.6,B.Tech in Computer Science,Lake Timothyshire
Arthur Atkinson,daniel13@bailey.com,(827)238-3515,"LLM Fine-tuning, Machine Learning, TensorFlow, RAG, Transformers",4.9,B.Sc in Data Science,Lucasberg
Anthony Smith,pattersondawn@gmail.com,361-107-0264x15386,"LLM Fine-tuning, Generative AI, LangChain, Vector DB, Deep Learning, Machine Learning",6.2,B.Sc in Data Science,Miguelside
Jacob Santos,christine62@clark.com,374-899-0464x4639,"FastAPI, Machine Learning, Hugging Face, Vector DB, Generative AI, TensorFlow",5.8,PhD in Machine Learning,New Lindsayside
Scott Lopez,christianjackson@schroeder.com,187-694-5907x3563,"PyTorch, Transformers, LLM Fine-tuning, Generative AI, LangChain, Python",2.3,M.Tech in AI,Lindaville
John Reynolds,michael70@yahoo.com,221.760.4055x71734,"Transformers, PyTorch, Prompt Engineering, OpenAI API, TensorFlow, Generative AI",8.3,M.Sc in Computer Applications,Stephanieton
Ashley Lopez,pbaker@yahoo.com,673-958-0712,"OpenAI API, Transformers, RAG, Prompt Engineering, Generative AI",2.2,M.Sc in Computer Applications,Port Ronnieview
Michele Flores,brucezachary@johnson.com,818-708-2015x52094,"Generative AI, Machine Learning, PyTorch, Transformers, Deep Learning",1.7,PhD in Machine Learning,Tinaview
Melissa Howard,powersrobert@cantu-parker.com,153-098-8510x57953,"FastAPI, RAG, Vector DB, Hugging Face, LangChain",1.1,M.Sc in Computer Applications,Jillfort
Joseph Hunter,bjohnson@harrison.com,+1-311-345-3412x9689,"FastAPI, Deep Learning, Prompt Engineering, LangChain, RAG, Hugging Face, Vector DB, Generative AI",3.1,B.Sc in Data Science,Port Juliefort
Marvin Porter,wjohnson@bates-padilla.com,500.848.3225x64058,"Prompt Engineering, RAG, LangChain, FastAPI, OpenAI API, Deep Learning",1,B.Tech in Computer Science,Port Ryan
Mr. Tristan Ryan,monroeclaudia@yahoo.com,155-510-8839,"PyTorch, Vector DB, Generative AI, Deep Learning, OpenAI API, FastAPI",9.4,B.Tech in Computer Science,East Julianview
Caroline Hays,boydmaria@jimenez.com,7612076091,"LangChain, FastAPI, RAG, LLM Fine-tuning, Hugging Face, OpenAI API, TensorFlow, Prompt Engineering",4.4,PhD in Machine Learning,Janethaven
Ivan Obrien,wilsonstephen@church-garza.com,001-982-888-7619x0981,"Python, RAG, LLM Fine-tuning, Deep Learning, PyTorch",3.1,M.Sc in Computer Applications,Ramosbury
David Hall,qwilson@yahoo.com,+1-471-906-8502x5047,"Prompt Engineering, Vector DB, LLM Fine-tuning, Transformers, Hugging Face, PyTorch, RAG, Generative AI",6.7,M.Tech in AI,Hansonmouth
Sherry Cox,bonnie64@evans.com,+1-284-927-9050x090,"TensorFlow, Deep Learning, PyTorch, RAG, OpenAI API",1.2,B.Tech in Computer Science,Port Markport
Sean Bishop,rmedina@murphy.com,9771204840,"TensorFlow, Deep Learning, Vector DB, Prompt Engineering, Hugging Face, OpenAI API, FastAPI",7.6,B.Sc in Data Science,Lake John
Jaime Smith,lbarron@kerr.info,010-073-8731x075,"FastAPI, Transformers, Hugging Face, Generative AI, LLM Fine-tuning, PyTorch, Vector DB",7.5,B.Sc in Data Science,Thomaschester
Brittney Oliver,kevin20@yahoo.com,001-889-531-7676x4510,"RAG, Hugging Face, OpenAI API, LangChain, Vector DB",4.2,B.Tech in Computer Science,Chaseberg
Jenny Mendoza,angelataylor@yahoo.com,(005)872-2140x37551,"Hugging Face, Machine Learning, PyTorch, Python, LLM Fine-tuning, TensorFlow",6.3,M.Tech in AI,Mitchellview
Kelly Poole,owilliams@hotmail.com,649.184.3950x301,"OpenAI API, Deep Learning, RAG, Python, TensorFlow, LangChain",8.3,B.Tech in Computer Science,Colemouth
John Baxter,christopher70@jimenez-castillo.org,772-034-4587x5113,"Transformers, OpenAI API, LangChain, Generative AI, Prompt Engineering",7.7,PhD in Machine Learning,Valdezton
Michael Watts,johnclark@yahoo.com,(540)810-3848x584,"Hugging Face, LangChain, RAG, Deep Learning, Transformers",2.5,B.Tech in Computer Science,Davidchester
Pamela Green,harrisjoshua@pham.com,(463)142-0182,"Generative AI, TensorFlow, Transformers, Hugging Face, LLM Fine-tuning, Deep Learning, LangChain, Vector DB",4.3,B.Tech in Computer Science,South Brandon
Jessica Briggs,fchapman@allen.biz,(382)712-9895x77041,"FastAPI, TensorFlow, RAG, LangChain, OpenAI API, Transformers, Deep Learning",1.2,PhD in Machine Learning,West Alvin
Larry Torres,ibrewer@yahoo.com,-9144,"Python, Transformers, TensorFlow, LangChain, Prompt Engineering, PyTorch, LLM Fine-tuning, RAG",8.8,M.Tech in AI,Loganton
Randy Velasquez,carlsharp@hotmail.com,880.481.7417x3779,"Transformers, Python, TensorFlow, Machine Learning, Prompt Engineering, LangChain",6.9,B.Sc in Data Science,Richardburgh
Richard Obrien,thomaslucas@valentine.com,196-799-8839,"Machine Learning, LLM Fine-tuning, Python, Deep Learning, Transformers, LangChain, Prompt Engineering",3,M.Tech in AI,South Tyler
Brittany Gonzales,rmiller@anderson-kline.com,003-252-2707x0260,"TensorFlow, OpenAI API, Hugging Face, LangChain, Vector DB",1.6,M.Sc in Computer Applications,New Luisfurt
Linda Stafford,carriemoore@lane.com,001-661-807-7267,"Machine Learning, Python, PyTorch, Transformers, TensorFlow, Generative AI",5.3,M.Sc in Computer Applications,Ericview
Thomas Kidd,hgonzalez@obrien.com,+1-893-857-6003x335,"Deep Learning, Vector DB, FastAPI, Generative AI, TensorFlow, LLM Fine-tuning, LangChain, Hugging Face",1,PhD in Machine Learning,Port Joshua
Jeffery Rollins,aarmstrong@smith.com,9877018447,"OpenAI API, Hugging Face, PyTorch, Transformers, RAG, Deep Learning",1.1,PhD in Machine Learning,Teresastad
Michael Kelley,susan42@yahoo.com,406-126-6293,"Prompt Engineering, Hugging Face, Machine Learning, Python, OpenAI API",2.8,PhD in Machine Learning,Amymouth
Robert Hamilton,kristin63@gmail.com,+1-292-625-6369x0666,"LLM Fine-tuning, FastAPI, Generative AI, LangChain, OpenAI API, Prompt Engineering",2.4,M.Tech in AI,Haasborough
Dr. Willie Lowe,gtaylor@gmail.com,133.947.0098,"Transformers, Prompt Engineering, Python, Machine Learning, LLM Fine-tuning, OpenAI API, TensorFlow, Generative AI",7.8,B.Tech in Computer Science,East Danielfort
Douglas Miller,abaker@hotmail.com,302-235-7408x8724,"RAG, Generative AI, TensorFlow, Python, Deep Learning",4.5,M.Sc in Computer Applications,New Marthabury
Eric Holland,andrew45@fernandez.com,809-283-0774,"PyTorch, Machine Learning, Prompt Engineering, LLM Fine-tuning, TensorFlow, Vector DB, Deep Learning, OpenAI API",3.6,B.Sc in Data Science,Paulshire
Melissa Mccarty,bnelson@yahoo.com,(969)386-9346x170,"FastAPI, Generative AI, PyTorch, Hugging Face, Vector DB, Machine Learning",9.9,M.Tech in AI,West Margaretbury
Brenda Combs,eric52@gmail.com,(424)275-4962,"Hugging Face, Generative AI, OpenAI API, LLM Fine-tuning, Vector DB, RAG, TensorFlow, PyTorch",2.1,M.Tech in AI,Greenland
Tara Phillips,amarshall@yahoo.com,836.706.7192,"RAG, Vector DB, FastAPI, Machine Learning, Generative AI, PyTorch",7.2,M.Sc in Computer Applications,Lake Steven
Sheila Schneider,alexandrakline@walker-dudley.org,(585)996-1171x9216,"LangChain, PyTorch, Hugging Face, Generative AI, TensorFlow, Vector DB",5.1,M.Sc in Computer Applications,Johnsonport
John Williams,smithcarl@hotmail.com,(777)317-6613,"Machine Learning, LLM Fine-tuning, Hugging Face, Deep Learning, LangChain, OpenAI API",1.4,B.Sc in Data Science,Jonesberg
Nicholas Boyle,davidsoncindy@west.com,613-984-9361x82691,"Hugging Face, TensorFlow, Deep Learning, Generative AI, Vector DB, Machine Learning, FastAPI, Prompt Engineering",7.2,M.Tech in AI,Ashleyport
Rachel Mueller,rodriguezcassandra@barrett.org,+1-839-369-7431x474,"Prompt Engineering, Machine Learning, TensorFlow, PyTorch, Deep Learning, LangChain",2,PhD in Machine Learning,Faithmouth
Paul Hunter,blankenshipmeagan@gmail.com,036-270-5292,"LLM Fine-tuning, PyTorch, Vector DB, Prompt Engineering, Python",8.4,M.Tech in AI,North Sabrina
Sabrina Ibarra,thompsonerica@rosario-solomon.net,+1-016-576-7042x23633,"Transformers, Vector DB, Machine Learning, PyTorch, Generative AI, RAG, Prompt Engineering, FastAPI",4.9,M.Sc in Computer Applications,West Juliebury
David Scott,gomezdavid@gmail.com,260-375-7326x468,"OpenAI API, Hugging Face, Deep Learning, PyTorch, LLM Fine-tuning, LangChain",2.2,B.Sc in Data Science,West Sarahfurt
Christie Austin,christine06@hotmail.com,291.071.5916x27891,"Machine Learning, Prompt Engineering, PyTorch, LangChain, Python, Deep Learning, Vector DB, FastAPI",7.6,M.Tech in AI,East Robertfort
Dawn Odonnell,arnoldlisa@gmail.com,637.919.7992,"Transformers, Prompt Engineering, Machine Learning, Generative AI, Deep Learning, OpenAI API",6,PhD in Machine Learning,Floresborough
